{
  "$schema": "https://json-schema.org/draft/2020-12/schema",
  "$id": "https://permdock.com/schemas/approval-request-v1.json",
  "title": "PermDock approval request",
  "description": "An ApprovalRequest as an ApprovalStore holds it, wire format v1. Unknown properties are allowed so a v1 minor release can add one.",
  "type": "object",
  "required": [
    "v",
    "id",
    "token",
    "permission",
    "scope",
    "resource",
    "subject",
    "detail",
    "createdAt",
    "expiresAt",
    "status"
  ],
  "properties": {
    "v": {
      "const": 1
    },
    "id": {
      "type": "string",
      "minLength": 1
    },
    "token": {
      "type": "string",
      "minLength": 1
    },
    "permission": {
      "type": "string",
      "minLength": 1
    },
    "scope": {
      "type": "string"
    },
    "resource": {
      "type": "object",
      "required": ["type"],
      "properties": {
        "type": {
          "type": "string"
        },
        "id": {
          "type": "string"
        }
      }
    },
    "subject": {
      "$ref": "#/$defs/subject"
    },
    "membership": {
      "type": "object",
      "required": ["roles"],
      "properties": {
        "roles": {
          "type": "array",
          "items": {
            "type": "string"
          }
        }
      }
    },
    "approvers": {
      "type": "object"
    },
    "detail": {
      "type": "string"
    },
    "adapter": {
      "type": "string"
    },
    "createdAt": {
      "$ref": "#/$defs/instant"
    },
    "expiresAt": {
      "$ref": "#/$defs/instant"
    },
    "status": {
      "enum": ["pending", "approved", "rejected", "expired"]
    },
    "approvals": {
      "type": "array",
      "items": {
        "$ref": "#/$defs/signature"
      }
    },
    "resolvedAt": {
      "$ref": "#/$defs/instant"
    },
    "resolvedBy": {
      "type": "string"
    },
    "vouched": {
      "type": "string"
    },
    "note": {
      "type": "string"
    },
    "consumedAt": {
      "$ref": "#/$defs/instant"
    }
  },
  "$defs": {
    "instant": {
      "type": "string",
      "format": "date-time",
      "pattern": "^\\d{4}-\\d{2}-\\d{2}T\\d{2}:\\d{2}:\\d{2}(\\.\\d+)?(Z|[+-]\\d{2}:\\d{2})$"
    },
    "subject": {
      "type": "object",
      "required": ["principal"],
      "properties": {
        "principal": {
          "anyOf": [
            {
              "type": "null"
            },
            {
              "type": "object",
              "required": ["id", "roles"],
              "properties": {
                "id": {
                  "type": "string"
                },
                "roles": {
                  "type": "array",
                  "items": {
                    "type": "string"
                  }
                },
                "tenant": {
                  "type": "string"
                }
              }
            }
          ]
        },
        "actor": {
          "type": "object",
          "required": ["id", "kind"],
          "properties": {
            "id": {
              "type": "string"
            },
            "kind": {
              "type": "string"
            }
          }
        },
        "session": {
          "type": "string"
        },
        "delegation": {
          "type": "object",
          "properties": {
            "scope": {
              "type": "string"
            },
            "authorization_details": {
              "type": "array",
              "items": {
                "type": "object",
                "required": ["type"],
                "properties": {
                  "type": {
                    "type": "string"
                  }
                }
              }
            }
          }
        }
      }
    },
    "signature": {
      "type": "object",
      "required": ["by", "at"],
      "properties": {
        "by": {
          "type": "string"
        },
        "at": {
          "$ref": "#/$defs/instant"
        },
        "stage": {
          "type": "integer",
          "minimum": 0
        },
        "vouched": {
          "type": "string"
        },
        "onBehalfOf": {
          "type": "string"
        },
        "delegation": {
          "type": "string"
        }
      }
    }
  }
}
